English,Urdu
Strongly recommend freh and tasty food I have ever eaten,سختی سے تازہ اور مزیدار کھانے کی سفارش کرتا ہوں جو میں نے کبھی کھایا ہے۔
You can get mouth watering Kababs parathas and halwa,آپ منہ میں پانی بھرنے والے کباب، پراٹھے اور حلوہ لے سکتے ہیں۔
Have you a reservation,کیا آپ نے مخصو ص کرا لیا ہے؟
“Speak truth each one of you with his neighbor”,’’تم میں سے ہر ایک اپنے پڑوسی سے سچ بولے۔‘‘
They said Have we not forbidden thee all beings,وہ بولے کیا ہم بارہا تمہیں منع نہیں کر چکے ہیں کہ دنیا بھر کے ٹھیکے دار نہ بنو؟
Nicely served fresh fish,اچھی طرح سے تازہ مچھلی پیش کی گئی۔
Something different than Bar B Que Tonight,بار بی کیو ٹونائٹ سے کچھ مختلف
They arrived at six oclock,وہ چھ بجے پہنچے۔
Fred is always telling lies,فریڈ ہمیشہ جھوٹ بولتا ہے۔
Your friend can lend you the money,مجھے یقین ہے کہ یہ کتا مجھے کاٹ لے گا۔ اوہ نہیں، یہ
Lovely Taste️,خوبصورت ذائقہ️
People gave the queen warm welcome,لوگوں نے ملکہ کا پرتپاک استقبال کیا۔
Now the game is over,اب تو کھیل ختم ہوچکا ہے۔
Come come I repeated impatiently,آو آو میں نے بے صبری سے دہرایا۔
Fritz did as he was bid,فرٹز نے ویسا ہی کیا جیسے اسے بولی تھی۔
Nahari specialist,نہاری ماہر
Nice food specially shahi handi it is a must try,اچھا کھانا، خاص طور پر شاہی ہانڈی یہ ضرور آزمانا ہے۔
Good but not exceptional,اچھا لیکن غیر معمولی نہیں۔
Good and tasty ambiance should improve,اچھا اور لذیذ ماحول بہتر ہونا چاہیے۔
Above Avg,اوسط سے اوپر
It was good but quantity was very less as compare to the price,یہ اچھا تھا لیکن قیمت کے مقابلے میں مقدار بہت کم تھی۔
Supreme quality and taste live BBQ,اعلی معیار اور ذائقہ لائیو BBQ
Great restaurant,زبردست ریستوراں۔
Id rather die than give up,مین ہار ماننے سے مرنا مناسب سمجھتا ہوں۔
I need help with this stuff,مجھے اس سے مدد کی ضرورت ہے۔
Delicious fish ever,کبھی بھی مزیدار مچھلی۔
Best BBQValue for MoneyScrumptious,بہترین باربی کیوپیسے کی قدربہترین
Brain masala awsome,دماغی مسالہ زبردست
Love it,اس سے پیار کریں
Just good,بس اچھا
Pathetic food Only Nihari is good,قابل رحم کھانا۔ صرف نہاری اچھی ہے۔
Good environment and tasty dishes,اچھا ماحول اور لذیذ پکوان
over crowd and too place not comfortable sevice very baad,زیادہ ہجوم اور جگہ جگہ آرام دہ نہیں سروس بہت بری
Awesome food good ambience and service was great,بہت اچھا کھانا، اچھا ماحول اور سروس بہت اچھا تھا
Granges are good to eat,گرینجز کھانے میں اچھے ہیں۔
Good place for family dinner food is Ok,فیملی ڈنر کے لیے اچھی جگہ ٹھیک ہے۔
Thats a dull grammar youre reading isnt it,یہ ایک مدھم گرامر ہے جسے آپ پڑھ رہے ہیں، ہے نا؟
Family  restaurant,فیملی ریستوراں
No space for sitting that are the negetive point,بیٹھنے کے لیے جگہ نہیں جو کہ منفی نقطہ ہے۔
Good place for Bar B Q items,بار بی کیو آئٹمز کے لیے اچھی جگہ
Awesome but food delivery took longer than mentioned,زبردست لیکن کھانے کی ترسیل میں ذکر سے زیادہ وقت لگا
O Being financially responsible,0 مالی طور پر ذمہ دار ہونا۔
Wheres the food,کھانا کہاں ہے؟
Thanks,شکریہ
Used to be good Have not been there recently,اچھا ہوا کرتا تھا۔ حال ہی میں وہاں نہیں گئے ہیں۔
Nehari is good but service is seriasly bad,نہاری اچھی ہے لیکن سروس بہت بری ہے۔
Its not a very big house,یہ کوئی بہت بڑا گھر نہیں ہے۔
Economiacal and best food Ambiance is zabardast,معاشی اور بہترین کھانا۔ ماحول خوش آئند ہے۔
Tasteless food,بے ذائقہ کھانا
Don’t Be Duped Each year,ہر سال دھوکہ نہ کھائیں۔
Your mother will be back before long,تمہاری ماں بس راستے میں ہو گی۔
The wood was dense up to the very edge of the road,سڑک کے بالکل کنارے تک لکڑی گھنی تھی۔
I cannot understand,میں نہیں سمجھ سکا۔
Very nice restaurants  gyms  there,وہاں بہت اچھے ریستوراں اور جم ہیں۔
A good place for fresh food and with taste,تازہ کھانے اور ذائقے کے ساتھ ایک اچھی جگہ
Awesome beef karahi,لاجواب بیف کراہی۔
Can you speak English,کیا آپ انگریزی بول سکتے ہیں؟
Good for friends,دوستوں کے لیے اچھا ہے۔
Good for desi items,دیسی اشیاء کے لیے اچھا ہے۔
O Finishing chores,0 کام ختم کرنا۔
We said O fire be coolness and safety for Abraham,ہم نے کہا اے آگ، ٹھنڈی ہو جا اور سلامتی بن جا ابراہیمؑ پر
He has got to go now,اسے اب جانا ہے۔
Look it up on the internet,انٹرنیٹ پر تلاش کر لو
What has sped thee far from thy people Moses,اور کیا چیز تمہیں اپنی قوم سے پہلے لے آئی موسیٰؑ؟
I love her,میں اس سے پیار کرتا ہوں۔
Its yummy as always need to get better in services,یہ مزیدار ہے جیسا کہ ہمیشہ خدمات میں بہتر ہونے کی ضرورت ہے۔
Look up the chimney,چمنی کو دیکھو۔
Nice place to be specially upstairs,رہنے کے لیے اچھی جگہ، خاص طور پر اوپر
He leaves at six,وہ چھ بجے چلا جاتا ہے۔
Will you explain problem to me,کیا آپ مجھے مسئلہ بتائیں گے؟
No delicious food,کوئی لذیذ کھانا نہیں۔
Bad service,بری سروس۔
There is no room in this train,اس گاڑی میں کوئی جگہ نہیں ۔
I couldnt keep from snickering,میں ہنسے بغیر نہیں رہ سکتی تھی۔
Tasty food especially fish of all kinds Reasonable rates,لذیذ کھانے خصوصاً ہر قسم کی مچھلی۔ مناسب نرخ۔
Cool n calm hygienic environment,ٹھنڈا اور پرسکون حفظان صحت کا ماحول
Best Nihari you can find in Karachi,بہترین نہاری جو آپ کو کراچی میں مل سکتی ہے۔
Good food but no proper sitting arrangement,کھانا اچھا لیکن بیٹھنے کا مناسب انتظام نہیں۔
“I don’t trust you enough to confide in you,لیکن آپ کے والدین سنتے ہیں
Great food with good price and quantity,اچھی قیمت اور مقدار کے ساتھ زبردست کھانا
No proper sitting area for family,فیملی کے لیے بیٹھنے کی جگہ نہیں ہے۔
Very good place,بہت اچھی جگہ
Delicious Food Excellent Staff and beautiful Venue,مزیدار کھانا بہترین عملہ اور خوبصورت مقام
Never message me,مجھے کبھی میسج نہ کرنا
Tasty however a bit over priced,سوادج، تاہم قدرے زیادہ
Lovely Food specially fry kabab,پیارا کھانا خاص طور پر کباب بھونیں۔
"”

The owner did not wait for a second invitation",مالک نے دوسری دعوت کا انتظار نہیں کیا۔
I wont spare you,وہ وعدے کا پکا ہے
These men are the wisest people of the tribe,یہ لوگ قبیلے کے سب سے دانشمند لوگ ہیں۔
Famous for its BBQ,اپنے BBQ کے لیے مشہور ہے۔
Chicken Makhni was good the rest was average,چکن مکھنی اچھی تھی، باقی اوسط درجے کی تھی۔
The food was very good but the order took a bit long to arrive,کھانا بہت اچھا تھا لیکن آرڈر پہنچنے میں تھوڑا وقت لگا
Was good but i think prices are lil bit high,اچھا تھا لیکن مجھے لگتا ہے کہ قیمتیں بہت زیادہ ہیں۔
Desi test,دیسی ٹیسٹ
The room is dark,کمرے سیاہ ہے۔
Too coastly,بہت ساحلی ۔
What do you think Miss West,آپ کا کیا خیال ہے، ویسٹ صاحبہ؟
Best Bar B Q in town,شہر میں بہترین بار BQ
Good place to have kebab fry kabab,کباب کھانے کے لیے اچھی جگہ کباب بھونیں۔
Good food good taste good quality and parking space,اچھا کھانا اچھا ذائقہ اچھا معیار اور پارکنگ کی جگہ
It does not matter,کوئی بات نہیں
Pathetic behavior of waiters and manager mohsin,ویٹر اور منیجر محسن کا قابل رحم رویہ
Toms fast,ٹام تیز ہے۔
Outstanding service and food also,شاندار سروس اور کھانا بھی
What sort of assurance can you provide,آپ اس چیز کی کیا  ضمانت دیتے ہیں۔
They are big wig,وہ بڑے وگ ہیں
Excellent place for Nihari lovers,نہاری سے محبت کرنے والوں کے لیے بہترین جگہ
Why did you write the exercise in pencil,میں نے اسے پچھلے ہفتے بلیک بورڈ پر لکھا تھا۔
No one has drunk out of this glass,اس گلاس سے کسی نے نہیں پیا ہے
I eat a lot of meat,میں کافی زیادہ گوشت کھاتا ہوں۔
Far be it from me to contradict the King said I,میں نے کہا کہ بادشاہ کی مخالفت کرنا مجھ سے دور ہے۔
"Very Good Restaurant
NEHARI AND PAYA WAS A AMAZING",بہت اچھا ریستوراں نہاری اور پیا ایک حیرت انگیز تھا۔
Go upwards,اوپر جائیں۔
Every thing is perfect,ہر چیز کامل ہے۔
This chair has been mended,اس کرسی کو ٹھیک کر دیا گیا ہے۔
Taste was good but the service is poor,ذائقہ اچھا تھا، لیکن سروس غریب ہے
According to the Italians translators are traitors,اطالویوں کے مطابق، مترجمان غدار ہوتے ہیں۔
No need to go to kemari  bring your family here,کیماڑی جانے کی ضرورت نہیںاپنی فیملی کو یہاں لے آؤ
He plays football everyweek,وہ ہر ہفتے فٹ بال کھیلتا ہے۔
When will you pay the debt,تم قرض کب ادا کرو گے؟
Who’ll foot the bill,بل کو کون کرے گا۔
Best food cooperative staff,بہترین خوراک، کوآپریٹو عملہ
Nice taste but not suitable for family,اچھا ذائقہ لیکن خاندان کے لیے موزوں نہیں ہے۔
Youre very special,تم بہت خاص ہو
great bbq try you will definitely love i its extremely awesome,عظیم بی بی کیو کوشش کریں آپ یقینی طور پر مجھے پسند کریں گے یہ انتہائی زبردست ہے۔
You are adorable and I love you,آپ بہت پیاری ہو اور میں آپ سے پیار کرتا ہوں۔
Good taste but low in quantity,ذائقہ اچھا لیکن مقدار میں کم
Thats a nice place and nice taste,یہ ایک اچھی جگہ اور عمدہ ذائقہ ہے۔
Hight rate with normal test,نارمل ٹیسٹ کے ساتھ ہائی ریٹ۔
Too good best quality food,بہت اچھا بہترین معیار کا کھانا
What’s the day today,آج کونسا دن ہے؟
“Pardieu” said Villefort “he is a noble fellow,پارڈیو ویلفورٹ نے کہا، وہ ایک شریف آدمی ہے۔
Excellent ambiance very good quality food,بہترین ماحول، بہت اچھے معیار کا کھانا
You dont look so good,تم کافی بیمار لگ رہے ہو۔
Food is good but alot of ret,کھانا اچھا ہے لیکن ریٹ بہت ہے۔
Taste is amazing The best alternative to Nandos in Karachi imo,ذائقہ حیرت انگیز ہے کراچی میں نندوز کا بہترین متبادل imo۔
It wasnt long,یہ طویل نہیں تھا
MASHAALLAH NICE EXPERIENCE,ماشاءاللہ اچھا تجربہ ہے۔
Dosa are Best,ڈوسا بہترین ہیں۔
You have a beautiful name,بہت خوبصورت نام ہے تمہارا۔
We hardly realize how important it is,ہمیں کبھی کبھی احساس ہوتا ہے کہ یہ کتنا ضروری ہے۔
even such men as are patient and put their trust in their Lord,جنہوں نے صبر کیا ہے اور جو اپنے رب کے بھروسے پر کام کر رہے ہیں کہ کیسا اچھا انجام اُن کا منتظر ہے
Normal but expensive food,عام لیکن مہنگا کھانا
Food was too good but place was very hot,کھانا بہت اچھا تھا لیکن جگہ بہت گرم تھی۔
Vip place,وی آئی پی جگہ
Food was delicious and specially Thali serving,کھانا مزیدار تھا اور خاص طور پر تھالی پیش کی گئی۔
Never going to visit this place ever,اس جگہ پر کبھی نہیں جانا
Excellent food  clean place  value for money,بہترین کھانا صاف ستھری جگہ پیسے کی قدر
Do you want to leave home to get away from problems,کیا آپ مسائل سے بچنے کے لیے گھر چھوڑنا چاہتے ہیں؟
Every thing is excellent but their pasta is not that much good,ہر چیز بہترین ہے لیکن ان کا پاستا اتنا اچھا نہیں ہے۔
BBQ and Karhai are awesome Nihari is average,BBQ اور Karhai بہت اچھے ہیں۔ نہاری اوسط ہے۔
And then came the Duke of Strelsau,اور پھر ڈیوک آف اسٹریلساؤ آیا۔
They told the new student where to sit,انہوں نے نئے طالب علم کو بتایا کہ کہاں بیٹھنا ہے۔
Best for mutton qorma,مٹن قورمہ کے لیے بہترین
Food is good but catering not well,کھانا اچھا ہے لیکن کیٹرنگ ٹھیک نہیں ہے۔
Good sajji,اچھا سجی۔
No good food no good atmosphere and very poor service,اچھا کھانا نہیں، اچھا ماحول نہیں اور انتہائی ناقص سروس
WHAT is binge drinking,بینج پینا کیا ہے؟
I have to give my exam,مجھے اپنا امتحان دینا ہے۔
"”

“I have found already",’’میں نے پہلے ہی ڈھونڈ لیا ہے۔
Mutton peshawari karahi is must have,مٹن پشاوری کراہی ضرور ہونی چاہیے۔
and even your pets,اور یہاں تک کہ آپ کے پالتو جانور بھی
French is their mother tongue,فرانسیسی ان کی مادری زبان ہیں۔
Good place for hangouts,hangouts کے لیے اچھی جگہ
Nice to have family dinners,فیملی ڈنر کر کے اچھا لگا
Good for food and relaxing,کھانے اور آرام کرنے کے لیے اچھا ہے۔
Uniquely tasteful food,منفرد ذائقہ دار کھانا
"Mashaalah so delicious dishes
With excellent service",ماشاءاللہ بہت لذیذ پکوان بہترین سروس کے ساتھ
home made dessert is must,گھر کی میٹھی ضروری ہے
Fresh and good taste,تازہ اور اچھا ذائقہ
Worst management in KTown period,KTown میں بدترین انتظام، مدت
This is a good place to get desi food with air conditioning,ایئر کنڈیشنگ کے ساتھ دیسی کھانا حاصل کرنے کے لیے یہ ایک اچھی جگہ ہے۔
Dellisus teasty food in town,شہر میں ڈیلیسس ذائقہ دار کھانا
Best place for indian food especially dosa and thali,ہندوستانی کھانے خصوصاً ڈوسا اور تھالی کے لیے بہترین جگہ
Foods are good but I think expensive,کھانے اچھے ہیں لیکن میرے خیال میں مہنگے ہیں۔
Tastless indian food but burgers were good,بے ذائقہ ہندوستانی کھانا لیکن برگر اچھے تھے۔
Why did he run away,وہ بھاگا کیوں؟
Cheese loader best tha,پنیر لوڈر بہترین تھا
Maybe were gonna work,شاید ہم کام کریں۔
I wont bore you with the details,میں تمہیں دیادہ تفصیل بتا کے بور نہیں کرو گی۔
Grill Prawns was too delicious,گرل جھینگے بہت لذیذ تھے۔
They need to work hard on taste and quality and also service,انہیں ذائقہ اور معیار اور خدمت پر بھی سخت محنت کرنے کی ضرورت ہے۔
good food but setting area is not so  good,اچھا کھانا لیکن سیٹنگ ایریا اتنا اچھا نہیں ہے۔
delicious koyla karahi and qeema taste,مزیدار کوئلہ کراہی اور قیمے کا ذائقہ
“Whenever I want to go out” says 16yearold Iliana,16 سالہ الیانا کہتی ہیں، ’’میں جب بھی باہر جانا چاہتی ہوں۔
Nihari was excellent Bar BQ tikka was also awesome,نہاری بہترین تھی۔ بار بی کیو ٹِکا بھی لاجواب تھا۔
What’s wrong with binge drinking,بینگ پینے میں کیا حرج ہے۔
Good place for lunch of office staff,دفتری عملے کے لنچ کے لیے اچھی جگہ
In Starting Awesome Flavour and Quantity,زبردست ذائقہ اور مقدار شروع کرنے میں
I think not Your Highness,مجھے نہیں لگتا، عالیہ
Went twice for sehrilate night dinner,سحری دیر رات کے کھانے کے لیے دو بار گیا۔
Vvip satup for food,کھانے کے لیے وی وی آئی پی سیٹ اپ
Go for the Shahi Chatak Boti nothing else matters,شاہی چتک بوٹی کے لیے جائیں، کسی اور چیز سے فرق نہیں پڑتا۔
Good place neet and clean environment,اچھی جگہ اور صاف ستھرا ماحول
Nice place to have Pakistani BBQ,پاکستانی BBQ رکھنے کے لیے اچھی جگہ
Excellent quality food Each and every dish was well prepared,بہترین معیار کا کھانا۔ ہر ڈش اچھی طرح تیار کی گئی تھی۔
I was tired so I went to bed,میں تھکا ہوا تھا اسی لئے میں سونے چلا گیا۔
Amazing and awesome,حیرت انگیز اور زبردست
No proper sitting area for family Over all taste is good,فیملی کے لیے بیٹھنے کی کوئی مناسب جگہ نہیں ہے ہر چیز کا ذائقہ اچھا ہے۔
Worst place for eating All dishes are smelly,کھانے کے لیے بدترین جگہ تمام پکوان بدبودار ہیں
First and a very bad experience from here,یہاں سے پہلا اور بہت برا تجربہ
Its great of you that you stopped for me,آپ کی نوازش ہے کہ آپ میرے لیے رکے۔
Bring us two orders of soup,ہمیں دو پلیٹ شو ر بے کی دیجئے
Nice sea food restaurant I have ever seenwonderful taste,اچھا سی فوڈ ریستوراں جو میں نے کبھی دیکھا ہے شاندار ذائقہ
He and only he knows the whole truth,وہ اور صرف وہ ہی پوری سچائی جانتا ہے۔
Place was nice neat  clean Food is average not so good,جگہ اچھی، صاف ستھری تھی، کھانا اوسطاً اتنا اچھا نہیں ہے۔
Good food good service nice place to be with Ur family,اچھا کھانا اچھی سروس اُر فیملی کے ساتھ رہنے کے لیے اچھی جگہ
This is good place for dinein with family or functions,یہ فیملی یا فنکشنز کے ساتھ کھانے کے لیے اچھی جگہ ہے۔
Good freshly made food,اچھا تازہ بنایا ہوا کھانا
Test Foods  Awesome Peoples,ٹیسٹ فوڈز اور زبردست لوگ
Specialist in Mutton chops and I enjoyed here with my Family,مٹن چپس کے ماہر اور میں نے اپنی فیملی کے ساتھ یہاں لطف اٹھایا۔
Delicious and clean food,مزیدار اور صاف ستھرا کھانا
Quality of taste amazing I highly recommended,ذائقہ کا معیار حیرت انگیز ہے جس کی میں نے سفارش کی ہے۔
Testy and healthy food,ٹیسٹ اور صحت بخش کھانا
Alif Lam Ra Those are the signs of the Manifest Book,ا، ل، ر یہ اُس کتاب کی آیات ہیں جو اپنا مدعا صاف صاف بیان کرتی ہے
Must try delicious food,مزیدار کھانے ضرور آزمائیں
Thats probably just a coincidence,شاید وہ صرف توارد ہے۔
Dont get up,اٹھو نہیں
It was great experience with Tandoor,تندور کے ساتھ یہ بہت اچھا تجربہ تھا۔
Food is not good,کھانا اچھا نہیں ہے۔
” This joke elicited a fresh burst of applause,اس لطیفے نے تالیوں کی ایک تازہ لہر کو جنم دیا۔
My youngest brother at binoria restaurant,بنوریا ریستوراں میں میرا سب سے چھوٹا بھائی
Not satisfied with food spice there is no normal spice flavor,کھانے کے مسالے سے مطمئن نہیں، مصالحے کا کوئی عام ذائقہ نہیں ہے۔
“Waiter” said Danglars “pen ink and paper,ویٹر، ڈینگلر نے کہا، قلم، سیاہی اور کاغذ
Tasteless overpriced food with lack of ventilation,وینٹیلیشن کی کمی کے ساتھ بے ذائقہ زیادہ قیمت والا کھانا
O Being punctual,0 وقت کا پابند ہونا۔
He cant speak English can he,اود انگلش نہیں بول سکتا ، ہے نا
I would like to say that,میں یہ کہنا چا ہوں گا کہ۔۔۔
Food is amazing,کھانا حیرت انگیز ہے۔
Nothing beats the bbq from Zamir Ansari,ضمیر انصاری کی طرف سے بی بی کیو کو کچھ نہیں مارتا
Good grilled peri wings,اچھی گرلڈ پیری ونگز
Is it late,کیا دیر ہوگئی ہے۔
Having good taste and pocket friendly as well,اچھا ذائقہ اور جیب دوست بھی
And now what,اور اب کیا؟
Lash push tasty khanaa,لذیذ کھنہ لش دھکا
Fine but slow,ٹھیک لیکن سست
Speak out,بولو۔
You had far better stay here,بہتر ہے کہ تم یہی رک جائو۔
The house is vacant,یہ گھر خالی ہے۔
"Food is nice
But the place is dirty Its not clean",کھانا اچھا ہے۔ لیکن جگہ گندی ہے۔ یہ صاف نہیں ہے۔
Good economical place Tasty food,اچھی اقتصادی جگہ۔ مزیدار کھانا
"greet food
great service",کھانے کی عظیم خدمت کو سلام
Nice breakfast place with family offering dine in,فیملی کے ساتھ ناشتے کی عمدہ جگہ جس میں کھانے کی پیشکش ہے۔
The makhni handi was too good there and the services were on par,وہاں مکھنی ہانڈی بھی اچھی تھی اور خدمات بھی برابر کی تھیں۔
Good for small dinners,چھوٹے کھانے کے لیے اچھا ہے۔
Lo quality food,لو معیاری کھانا
Anna is twelve years old,آنا بارہ سال کی ہیں۔
Not as good as we have thought,اتنا اچھا نہیں جتنا ہم نے سوچا ہے۔
yesterday we made plan of grand dawat here,کل ہم نے یہاں عظیم الشان دعوت کا منصوبہ بنایا
Light a fire in the sitttingroom,بیٹھنے کے کمرے میں آگ جلائیں۔
The Bible warns that if you overdrink,بائبل خبردار کرتی ہے کہ اگر آپ زیادہ پیتے ہیں۔
Best Chicken chow main ever,اب تک کا بہترین چکن چاؤ مین
One of the best and most delicious food Ive eat after long time,ایک بہترین اور لذیذ کھانا جو میں نے طویل عرصے کے بعد کھایا ہے۔
Now they have a better family hall very nive,اب ان کے پاس ایک بہتر فیملی ہال بہت اچھا ہے۔
Delicious food and prices are very low,لذیذ کھانے اور قیمتیں بہت کم ہیں۔
Why did you stop only the foreigners,آپ نے صرف غیرملکیوں کو کیوں روکا؟
Great place for both lunch and dinner,لنچ اور ڈنر دونوں کے لیے بہترین جگہ
Best Nihari in karachi,کراچی میں بہترین نہاری۔
Love it awsome n delicious food,اسے بہت اچھا اور مزیدار کھانا پسند ہے۔
“Sometimes I’ll talk to him for a while and then he’ll say ‘,"کبھی کبھی میں تھوڑی دیر اس سے بات کروں گا اور پھر وہ کہے گا،x000D
میں معافی چاہتا ہوں، کیا آپ مجھ سے بات کر رہے تھے؟x000D
 سوال اگر لیہ کو واقعی کسی مسئلے پر بات کرنے کی ضرورت ہو تو کیا ہوگا؟x000D
اس کے پاس کم از کم تین اختیارات ہیں۔x000D
اگر آپ کو کسی مسئلے کے بارے میں اپنے والدین والدین کے ساتھ بیٹھ کر بات کرنا مشکل لگتا ہے۔x000D
جب آپ ایک ساتھ چل رہے ہوں، گاڑی چلا رہے ہوں یا خریداری کر رہے ہوں تو اس معاملے پر بات کریں۔x000D
آپ کے والدین بات کرنا چاہتے ہیں، لیکن آپ ایسا نہیں کریں گے۔x000D
اسکول میں سخت دن کے فوراً بعد سوالات کا نشانہ بننے سے بدتر کوئی چیز نہیں ہے۔"
And he looked round about to see her that had done this thing,اُس نے چاروں طرف نِگاہ کی تاکہ جِس نے یہ کام کِیا تھا اُسے دیکھے ۔
That was great,یہ بہت اچھا تھا۔
Environment and food service is outstanding,ماحولیات اور کھانے کی خدمت شاندار ہے۔
